job_position,company_name,job_country,job_posting_date,Employment_type,Seniority_level,job_description
"Data Scientist, Product Analytics - Monetization",Meta,United States,2023-07-02,Full-time,Not Applicable,"As a Monetization focused Data Scientist at Meta, you will have the opportunity to help people and businesses make meaningful connections and build premium services across our entire family of applications (Facebook, Instagram, Messenger, WhatsApp, Reality Labs). By applying your technical skills, analytical mindset, and product intuition to one of the richest data sets in the world, you will help define the experiences we build for billions of people and hundreds of millions of businesses around the world, and change the way they connect and communicate. You will collaborate on a wide array of product and business problems with a diverse set of cross-functional partners across Product, Engineering, Research, Data Engineering, Marketing, Sales, Finance and others. You will use data and analysis to identify and solve product development’s biggest challenges. You will influence product strategy and investment decisions with data, be focused on impact, and collaborate with other teams. By joining Meta, you will become part of a world-class analytics community dedicated to skill development and career growth in analytics and beyond.Product leadership: You will use data to shape product development, quantify new opportunities, identify upcoming challenges, and ensure the products we build bring value to people, businesses, and Meta. You will help your partner teams prioritize what to build, set goals, and understand their product’s ecosystem.Analytics: You will guide teams using data and insights. You will focus on developing hypotheses and employ a diverse toolkit of rigorous analytical approaches, different methodologies, frameworks, and technical approaches to test them.Communication and influence: You won’t simply present data, but tell data-driven stories. You will convince and influence your partners using clear insights and recommendations. You will build credibility through structure and clarity, and be a trusted strategic partner.Data Scientist, Product Analytics - Monetization Responsibilities:Work with large and complex data sets to solve a wide array of challenging problems using different analytical and statistical approaches.Apply technical expertise with quantitative analysis, experimentation, data mining, and the presentation of data to develop strategies for our products that serve billions of people and hundreds of millions of businesses.Identify and measure success of product efforts through goal setting, forecasting, and monitoring of key product metrics to understand trends.Define, understand, and test opportunities and levers to improve the product, and drive roadmaps through your insights and recommendations.Partner with Product, Engineering, and cross-functional teams to inform, influence, support, and execute product strategy and investment decisions.Minimum Qualifications:Bachelor's degree in Mathematics, Statistics, a relevant technical field, or equivalent practical experience.A minimum of 6 years of work experience in analytics (minimum of 4 years with a Ph.D.)Experience with data querying languages (e.g. SQL), scripting languages (e.g. Python), and/or statistical/mathematical software (e.g. R)Preferred Qualifications:Masters or Ph.D. Degree in a quantitative field.Meta is proud to be an Equal Employment Opportunity and Affirmative Action employer. We do not discriminate based upon race, religion, color, national origin, sex (including pregnancy, childbirth, reproductive health decisions, or related medical conditions), sexual orientation, gender identity, gender expression, age, status as a protected veteran, status as an individual with a disability, genetic information, political views or activity, or other applicable legally protected characteristics. You may view our Equal Employment Opportunity notice here. We also consider qualified applicants with criminal histories, consistent with applicable federal, state and local law. We may use your information to maintain the safety and security of Meta, its employees, and others as required or permitted by law. You may view Meta's Pay Transparency Policy, Equal Employment Opportunity is the Law notice, and Notice to Applicants for Employment and Employees by clicking on their corresponding links. Additionally, Meta participates in the E-Verify program in certain locations, as required by law"
Data Scientist,NextGen Federal Systems,United States,2023-06-09,Full-time,Mid-Senior level,"NextGen Federal Systems, LLC (NextGen) is seeking a Geospatial Data Engineer/ Data Scientist to research, design, and implement innovate solutions across a variety of problem sets. Selected candidates will be part of a distributed development team operating in a dynamic, agile, fast-paced environment and will participate in all phases of the software engineering process including research, design, development, integration, deployment, and testing.Qualifications:Bachelor’s [Master’s /PhD] Degree in Computer Science, Math, Engineering, Physics, or related field6+ [4+ / 2+] years of work-related experience with applied geospatial data engineering developmentRequired Skills and Experience:Work as part of a team to design, develop, implement, and transition capabilities required by the client to meet their operational requirementsExperience with geospatial tools, data transformations, and databasingDeep understanding of data science workflows/techniques (data loading, data pre-processing techniques, data visualization, model selection, model training and scoring, model deployment)Familiarity with Python data processing packages such as pandas, numpy, scikit-learnStrong written & verbal communication skills, including technical writing and presentationsProficient in Microsoft Office (Word, Excel, PowerPoint, Access, and Outlook)About NextGen: NextGen Federal Systems is an innovative technology and professional services provider specializing in advanced software solutions and comprehensive mission and business support services. We work in close collaboration with our customers to truly understand their business and mission goals. Our approach is to design, build, implement, and manage solutions that measurably improve our client’s organizational performance. We have established and foster a corporate culture where we:Treat employees with fairness and respect regardless of their position, sexual identity, race, or tenure.Communicate the importance of our mission and our employees’ contributions to it, ensuring they understand how their job role contributes to the greater good.Openly promote and communicate our ideas for change and adaptability.Strive to achieve results as an organization.Hold employees accountable to their commitments and provide incentives that encourage positive and productive behaviors.Value the talents and contributions of our employees as the key factor for our success.Create an environment where people can engage at all levels.Encourage people to take risks and allow them to make mistakes.Equal Opportunity Employer/Protected Veterans/Individuals with Disabilities.RefID: A01"
Entry Level Data Scientist (Remote),SynergisticIT,United States,2023-06-08,Full-time,Entry level,"SYNERGISTICIT is aware that the Job Market is Challenging because of Tech Layoffs due to which The Job market is flooded with hundreds and thousands of laid off Jobseekers who are competing with existing Jobseekers. For entry level Job seekers to get client interviews and jobs they need to differentiate themselves by ensuring they have exceptional skills and technologies to be noticed by clients.Since 2010 we have helped Jobseekers differentiate themselves by providing the clients with candidates who have the requisite skills and experience to outperform at interviews and clients. Here at SynergisticIT We just don't focus on getting you a Job we make careers.All Positions are open for all visas and US citizensWe at Synergisticit understand the problem of the mismatch between employer's requirements and Employee skills and that's why since 2010 we have helped thousands of candidates get jobs at technology clients like apple, google, Paypal, western union, Client, visa, walmart labs etc to name a few.We have an excellent reputation with the clients. Currently, We are looking for entry-level software programmers, Java Full stack developers, Python/Java developers, Data analysts/ Data Scientists, Machine Learning engineers.Who Should Apply Recent Computer science/Engineering /Mathematics/Statistics or Science Graduates looking to make their careers in IT IndustryWe welcome candidates with all visas and citizens to apply.We assist in filing for STEM extension and also for H1b and Green card filing to CandidatesWe also offer Skill enhancement programs for candidates who are either missing skills or are lacking Industry/Client experience with Projects and skills. Candidates having difficulty in finding jobs or cracking interviews or who wants to improve their skill portfolio. If they are qualified with enough skills and have hands on project work at clients then no need for skill enhancement.Candidates can benefit from skill enhancement if they fall into the below categories.Candidates who Lack Experience or are freshers with No actual on Job experience with projects with clientsHave had a break in careersLack Technical Competency or skills being demanded by clientsDifferent visa candidates (Like OPT/H4EAD/L2EAD )who want to get employed and settle down in the USAplease check the below links to see success outcomes of our candidatesWatch the below videos of us participating at Industry events with the Top companies in Technology at Oracle Cloud world /Oracle Java one (Las vegas) and at Gartner Data Analytics Summit (Florida)(url removed)(url removed)If you have relevant skills and industry experience, please apply if not then candidates can opt for Skill enhancement.For getting help with interviews please visitREQUIRED SKILLS For Java /Software ProgrammersBachelors degree or Masters degree in Computer Science, Computer Engineering, Electrical Engineering, Information Systems, ITHighly motivated, self-learner, and technically inquisitiveExperience in programming language Java and understanding of the software development life cycleProject work on the skillsKnowledge of Core Java , javascript , C++ or software programmingSpring boot, Microservices, Docker, Jenkins and REST API's experienceExcellent written and verbal communication skillsFor data Science/Machine learningRequired SkillsBachelors degree or Masters degree in Computer Science, Computer Engineering, Electrical Engineering, Information Systems, ITProject work on the technologies neededHighly motivated, self-learner, and technically inquisitiveExperience in programming language Java and understanding of the software development life cycleKnowledge of Statistics, SAS, Python, Computer Vision, data visualization toolsExcellent written and verbal communication skillsPreferred skills: NLP, Text mining, Tableau, PowerBI, Time series analysisPlease understand skills and relevant experience on real world projects are required by clients for selection even if its Junior or entry level position the additional skills and Project work with hands on experience building projects at client site are the only way a candidate can be picked by clients. If not having the skills or hands on project work at client site then candidates can opt for skill enhancement to gain the required skills and project work.No third party candidates or c2c candidatesplease only apply to the postingNo phone calls please. Shortlisted candidates would be reached out."
"Data Scientist Analyst - Arlington, TX",Lockheed Martin,United States,2023-06-20,Full-time,Entry level,"Responsibilities IncludeLockheed Martin is seeking a Data Scientist Analyst Associate for a position in Arlington, TX to work in a creative environment with a focus on Quality.Perform deep dives into a trove of data to create meaningful outputs to help reach business objectives.Identify key attributes.Problem solve inputs and outputs for end users.Develop intuitive interfaces to mitigate risks and identify waste."
Marketing Data Scientist,SEPHORA,United States,2023-06-22,Full-time,Entry level,"Job ID: 230380Location Name: FSC REMOTE SF/NY/DC -173(USA_0173)Address: FSC, San Francisco, CA 94105, United States (US)Job Type: Full TimePosition Type: RegularJob Function: MarketingRemote Eligible: YesCompany OverviewAt Sephora we inspire our customers, empower our teams, and help them become the best versions of themselves. We create an environment where people are valued, and differences are celebrated. Every day, our teams across the world bring to life our purpose: to expand the way the world sees beauty by empowering the Extra Ordinary in each of us. We are united by a common goal - to reimagine the future of beauty.The OpportunityYour role at Sephora:As Marketing Data Scientist at Sephora, you will: Develop and implement analytics applications to transform raw data into meaningful information using data-oriented programming languages and visualization software. Develop data insights regarding improving marketing investments and business results. Analyze information from large structured and unstructured datasets. Work closely with marketing functions including Media Strategy, Creative, and Consumer Market Insights along with the investment strategy team financial planning and analysis, and external partners to manage efforts from end-to-end. Responsible for ensuring strategic and tactical marketing decisions are informed by data-driven insights. Develop customized Marketing Mix Modeling (MMM) projects involving specialized, nested regression models, forecasting/optimization, building dashboards, and presentations. Aggregate data sets from various database and publishers. Perform inferential statistical analysis in R statistical language to estimate marketing channel impact on sales and new customer acquisition. Position allows some work-from-home flexibility, with schedule to be approved by manager. Must be able to work on site as required.Minimum RequirementsMaster’s or foreign equivalent degree in Statistics, Economics, or a related field.Two (2) years of experience in a statistical analysis and media research for retail marketing metrics role.Experience Must IncludeExcelPowerPointCrimson HexagonAdobe AnalyticsMarine Marketing toolsTableauPower BIProgramming with R, SAS, VBA, Python, and SQLPredictive analysisData miningOptimizationForecastingClustering and classificationRegressionData envelopment analysisRate of Pay:  $153,088 to $169,000 per year.While at Sephora, you’ll enjoy… The people. You will be surrounded by some of the most talented leaders and teams – people you can be proud to work with. The learning. We invest in training and developing our teams, and you will continue evolving and building your skills through personalized career plans.The culture. As a leading beauty retailer within the LVMH family, our reach is broad, and our impact is global. It is in our DNA to innovate and, at Sephora, all 40,000 passionate team members across 35 markets and 3,000+ stores, are united by a common goal - to reimagine the future of beauty.You can unleash your creativity, because we’ve got disruptive spirit. You can learn and evolve, because we empower you to be your best. You can be yourself, because you are what sets us apart. This, is the future of beauty. Reimagine your future, at Sephora.Sephora is an equal opportunity employer and values diversity at our company. We do not discriminate on the basis of race, religion, color, national origin, ancestry, citizenship, gender, gender identity, sexual orientation, age, marital status, military/veteran status, or disability status. Sephora is committed to working with and providing reasonable accommodation to applicants with physical and mental disabilities.Sephora will consider for employment all qualified applicants with criminal histories in a manner consistent with applicable law."
Data Scientist,Connect Tech & Talent,United States,2023-07-01,Contract,Mid-Senior level,"Data ScientistRemoteTampa, Florida  Qualifications: • Master’s degree or bachelor’s degree in Data Science, Applied Mathematics, Statistics, Physics, Computer Science, or related fields. Proficient with Python • Demonstrated experience applying data science methods to real-world data problems • Demonstrated experience developing and deploying AI/ML in support of decision making • Current DoD Top Secret clearance and eligible for SCI access and ACCM read-onRequired Skills:  Python, R, Natural Language Processing (NLP), AI/ML OpsPreferred Skills (not limited to): SQL, noSQL, SQL Alchemy, Flask, Streamlit, Dash, React, Javascript, HTML/CSS, Spark, Application Programming Interfaces, Continuous Integration / Continuous Development (CI/CD)"
Data Scientist,"Farfield Systems, Inc",United States,2023-06-07,Full-time,Mid-Senior level,"About Farfield Systems, Inc.At Farfield we are committed to delivering trusted expertise to our government clients. As we grow, our focus is on increasing opportunities for you to grow with us while still delivering the same excellence customers have grown to expect from us. We continually evaluate our environment to provide a place where your career is packed with opportunities to grow and you have the ability to demonstrate your passion to our customers. We focus on building a Team where each employee is a valued member.Farfield provides support to multiple agencies across the United States Government in many locations. That means many different opportunities to follow your career path without changing companies every few years.""Employee driven...customer focused."" We build, operate and secure networks and infrastructure.*** Requires a Top Secret/SCI clearance with a polygraph and U.S. Citizenship***The full time Data Scientist will work with a team of modelers to parse, clean, analyze, and visualize network traffic data in support of a network modeling effort to project future bandwidth on the IC Network.Requirements:Experience with quantitative analysis or modelingExperience with developing requirements and building statistical or simulation modelsExperience with scripting or scientific languages and software, including Python, R, MATLAB, @RISK, ARENA, or SASTS/SCI clearance with a Full-Scope PolygraphBachelor’s degreeNice to Have:Experience with Free Open Source Software and Commercial Off-The Self Software products in statistics, Monte Carlo or discrete event simulation, extract, transform, and load Extract, Transform, Load processes, and quantitative workflow automationExperience with working in Linux OS environmentsAbility to consult with non-technical audiences on technical problems, work in a highly collaborative, team-oriented environment, and balance long- and short-term taskingAbility to take poorly defined problems and convert them into questions for which practical quantitative solutions can be definedAbility to be flexible, take initiative, and innovate to succeed in an ambiguous and fast-paced environment, composing client deliverable quality documentation, analysis, and reportsAbility to be detail-oriented and organizedPossession of excellent verbal and written communication skillsMaster's degree preferred; PhD degree a plusPowered by JazzHRnQ02pujuNQ"
Data Scientist,Global Network Technologies,United States,2023-06-21,Other,Entry level,"Job Title - Data ScientistLocation - Remote | HybridRemote role or onsite if local. Will need to train onsite about 2 weeks but will be 1 week first and then return for another week.Cary, NC, USJob Type -Full TimeCompensation - Benefits Are AvailableRelocation - Yes, regionalJob Description -This role is W2 only .Required SkillsData collection (ex. SQL data query, Power Automate)Data transformationData analysisBusiness Intelligence Application skills; Power BI required, others encouragedEnterprise Data Lake (EDL) experience preferredAbility to communicate with both technical and process experts and non-expert stakeholdersFamiliar with Accounting or Business Administration concepts and termsPower BI required, others encouraged.Responsibility Standardized Account Reporting - Account Manager PerformanceDevelop suite of tools for Account Managers to use in developing strategy and tactics for strategic accounts and contracts. Provide visibility to the work of the Account Managers with their assigned accounts/markets and enable their ability to develop key insights to share with dealers/stakeholders.Monthly/Quarterly/Annual Performance ReportingDeliver easy-to-use, easy-to-read dashboard to tell the SABD success story both within the department and to external stakeholders in Sales & Marketing, Accounting, Dealer Development, etc. Maintain data to ensure accuracy in reporting.OPC Audit Performance DashboardSupport managers and supervisors ability to measure overall team and individual team member performance in measures such as throughput and accuracy. Identify trends in volume, bottlenecks in capacity, and opportunities for continuous improvement using performance data.OPC Dealer Experience MeasuresEnable deep-dive conversations with dealers/stakeholders through tools that can reveal SLA level, support and response provided for accounts, contracts, dealer groups, and other potential data slices. Reveal insights to support dealer education, internal process improvement, or other solutions to describe and improve experience doing business with SABD."
Healthcare Data Scientist,OptimizeRx,United States,2023-06-21,Full-time,Entry level,"About OptimizeRxHealthcare Data Scientist Job DescriptionOptimizeRx Corporation (NASDAQ:OPRX) is the best-in-class health technology company, enabling car-focused engagement between life sciences organizations, healthcare providers, and patients at critical junctures throughout the patient care journey. Connecting over 60% of US healthcare providers and millions of their patients through a proprietary point-of-care network, connectivity is facilitated via its integrated Therapy Initiation and Persistence Platform.As Healthcare Data Scientist your primary responsibility is to execute exploratory analyses on healthcare data and build AI models to support customer deliverables. You’ll work to productionalize these analyses/models in robust pieces of software. You’ll be part of an integrated team of subject-matter experts, Physicians, Data Scientists & AI engineers, and a wider group of product/technology professionals.Core ResponsibilitiesAnalyze healthcare pathways and clinical dynamics relevant to patient & physician experiences to support client-facing solutionsCombine your healthcare knowledge with business/customer needs, translating those qualitative requirements into impactful Data Science deliverablesUse healthcare data to answer practical business questions, develop predictive (AI) modeling solutions that solve customer problems, and build software components/modules to help automate workflowsCreate advanced analyses on healthcare data including but not limited to: supervised AI models, descriptive & inferential statistics, exploratory data analysis (including unsupervised learning as needed), network analysis/inference, and natural language processingCollaborate with internal & external stakeholders to define the right work to be done; structure requirements and propose timelines for analytic deliverablesCommunicate with internal & external stakeholders to present results, including data visualizationsOther duties as assignedRequirementsBachelor’s degree in a quantitative field (Computer Science, Mathematics, Engineering), or scientific field with strong math/programming coursework2+ years’ experience developing quantitative products/analyses that make meaningful business impacts – driving better product/business decisions, delivering results to clients, or embedding intelligence into software products2+ years’ experience with fundamentals of advanced analytics and Machine Learning workflows, including Exploratory Data Analysis, Model Development, Interpretation, and Deployment2+ years’ experience working with healthcare data such as electronic medical records, medical claims, prescription drug claims, affiliation data, or other life sciences commercial or clinical data1+ years' experience building AI models, including deployment in production environmentsExcellent communication skills, both written and verbal. Able to cater to both technical and non-technical audiences.Demonstrated experience with PythonPreferred Experience/KnowledgeExperience with technologies such as: R, Bash/Basic Linux, Machine Learning Frameworks (Pytorch, Tensorflow, Sklearn), SQL, AWS suite, Databricks, PySpark, OMOP, and CI/CD tooling."
