job_position,company_name,job_country,job_posting_date,Employment_type,Seniority_level,job_description
Data Scientist,Deloitte,United States,2023-06-30,Full-time,Not Applicable,"Join our team and begin tackling critical issues at all levels of government in a team-focused environment with an emphasis on personal and professional growth. Now more than ever, organizations need support to address pressing needs in accounting, budgeting/forecasting, financial reporting, assurance, and internal controls. Accounting & Internal Controls (A&IC) is well-positioned to help our clients address their most urgent finance transformation needs. If you are interested in helping organizations effectively managefinancial risks, then our team would be a great fit for you!Work you'll do Identify opportunities for efficiencies in work process and innovative approaches to completing scope of workParticipate in team problem solving efforts and offer ideas to solve client issuesMaintain responsibility for completion and accuracy of work productsProvide experience and development for a Deloitte product in developmentThe teamDeloitte's Government and Public Services (GPS) practice - our people, ideas, technology and outcomes-is designed for impact. Serving federal, state, & local government clients as well as public higher education institutions, our team of over 15,000+ professionals brings fresh perspective to help clients anticipate disruption, reimagine the possible, and fulfill their mission promise.Our team provides resources to help clients manage their core accounting and financial reporting functions , as well as solutions to help them achieve their controls and finance transformation aspirations. Our professionals keep up with emerging regulatory guidance along with industry and business trends to assist financial organizations. We develop solutions to data complexities tohelp our clients achieve optimal finance transformation and meet their digital controllership goals and objectives.QualificationsRequired: Must be legally authorized to work in the United States without the need for employer sponsorship, now or at any time in the future.  Must be clearable and able to obtain a security clearance.  Associates degree in Accounting, Information Technology/Systems, Business, Finance or another Business-related field Must have 2+ years experience as a Data Scientist - linear algebra, experimental design, hypothesis testing, machine learningPreferred:Python ProgrammingR ProgrammingHow You'll GrowAt Deloitte, our professional development plan focuses on helping people at every level of their career to identify and use their strengths to do their best work every day. From entry-level employees to senior leaders, we believe there's always room to learn. We offer opportunities to help sharpen skills in addition to hands-on experience in the global, fast-changing business world. From on-the-job learning experiences to formal development programs, our professionals have a variety of opportunities to continue to grow throughout their career."
Data Scientist II,"RedSail Technologies, LLC",United States,2023-06-15,Full-time,Entry level,"Job SummaryAs the leading provider of pharmacy software solutions, RedSail Technologies is committed to serving community-focused pharmacies, and our mission is to build the most clinically advanced and financially sustainable pharmacy networks in the country. We are committed to harnessing the power of data and machine learning to drive intelligent decision-making and deliver exceptional products/services to our customers. We are seeking an experienced data scientist to join our team and contribute to the development and success of our data science initiatives.As a data scientist in our early-stage data science team, you will play a pivotal role in shaping the future of data-driven decision-making within our organization. You will work closely with cross-functional teams, including software development, product management, and business stakeholders, to identify opportunities for leveraging data to solve complex problems and drive actionable insights. This is an excellent opportunity for a self-driven and resourceful individual who enjoys taking ownership, thrives in a dynamic environment, and wants to make a significant impact from the ground up.Key DutiesCollaborate with stakeholders to identify and define data science opportunities aligned with business objectives.Collect, clean, and preprocess data from multiple sources to build robust datasets.Conduct exploratory data analysis to gain insights and identify patterns, trends, and correlations.Develop and deploy predictive models, machine learning algorithms, and statistical analyses.Communicate findings and present data-driven insights to technical and non-technical stakeholders.Stay up to date with the latest advancements in data science and bring innovative ideas to the team.Education/TrainingBachelor’s or Master’s in Data Science, Computer Science, Statistics, or a related field. Equivalent industry experience will also be considered.Required Skills/QualificationsThree or more years of experience solving business problems using machine learning techniquesProficient in Python and SQLExperience with data manipulation and visualization libraries (e.g., pandas, numpy, matplotlib).Experience with deep learning frameworks (Tensorflow/PyTorch)Experience with NLP applicationsSolid understanding of challenges of model deployment in real-world scenariosMust have curiosity and passion for continuous learning, readily adapting to new tools and techniquesMust be able to perform tasks and complete projects with minimal supervisionEffective communication skills to convey complex concepts to both technical and non-technical stakeholdersPreferred Skills/QualificationsExperience deploying machine learning models in a production environmentExperience with cloud platforms and related services (Azure preferred)Advanced knowledge of statisticsFamiliarity with distributed data/computing tools (e.g., Spark, Hadoop)Prior experience in an early-stage startup or building data science teamsDomain knowledge in pharmacy/healthcare"
Computational AI Data Scientist,Ashland,United States,2023-05-29,Full-time,Entry level,"Ashland Specialty Ingredients, GPAre you the kind of person that is always thinking, sketching, seeking, and needs to understand how things work; then then figure out how they can work better? Are you a passionate, tenacious, solver who loves to work with others who share your drive? Are you positive, constructive, and ingenious?Are you always solving?Then we’d like to meet you and bet you’d like to meet us.Ashland has an exciting opportunity for a computational chemist with experience using and developing AI tools to join our Applied Research Group, in Bridgewater, NJ. This is a very visible, significant role within the Company and global R&D. This position will support global R&D involving several new and exciting technologies.The responsibilities of the position include, but are not limited to, the following:Utilize advanced molecular simulation and data analytics methods to solve real world problems that provide benefits to societyDevelop creative simulation and analysis workflows and protocols.Grow AI capabilities and adoptionCollaborate with scientists and work effectively in focused project teamsPresent study results to internal and external audiencesPrepare clear well written reportsManage multiple projects, estimate timelines and resources, and coordinate efforts to meet timeline.Work closely with other R&D sites and technical support teams to solve challenging technical problems for customers.Comply with company procedural guidelines, procedures, and safety programs.In order to be qualified for this role, you must possess the following:A master’s or doctorate degree in a relevant area of chemistry, preferably physical chemistryExperience using modern computational chemistry and molecular simulation methods, such as quantum mechanics, molecular mechanics and molecular dynamics Experience using AI, machine learning, informatics and advanced data analysis toolsDeep understanding of physical chemistryA record of successful scientific achievementsDemonstrated ability to work in a collaborative team environmentAbility to travel within United States and overseas as needed for project supportMust be authorized to work in the United States The Following Skill Sets Are Preferred Familiar with organic chemistry principlesKnowledge about polymer chemistry and characterizationFamiliar with carbohydrate chemistry and characterizationExperience using scripting tools, or computer codingComfortable working with both LINUX and Windows computersExperience using coarse-grained simulation methodsIn more than 100 countries, the people of Ashland LLC. (NYSE: ASH) provide the specialty chemicals, technologies and insights to help customers create new and improved products for today and sustainable solutions for tomorrow. Our chemistry is at work every day in a wide variety of markets and applications, including architectural coatings, automotive, construction, energy, personal care and pharmaceutical. Visit www.ashland.com to see the innovations we offer.At Ashland our vision is to be a leading, global specialty chemicals company whose inspired and engaged employees add value to all we touch. In fact our people, employees, customers and vendors define who we are. They are the driving force behind everything we do.Not only do we value our customers but we value our employees, and we work to offer them a dynamic and challenging environment. We hold ourselves to high standards at Ashland, and we value integrity and honesty.Ashland has a history of attracting the best people and keeping them. The reasons are simple: industry competitive salary and benefits, pay-for-performance incentive plans and a diverse work environment where employees feel challenged and valued. People come to Ashland and stay. As a growing Fortune 500 specialty chemicals company, we offer opportunities for development and advancement throughout our global organization. Our values define who we are and what we care about as a company. If you are looking for a relationship with a company instead of simply a job, this may be a great fit.Ashland is proud to be an Equal Opportunity Employer Minorities/Women/Veterans/Disabled/Gender Identity/Sexual Orientation.All qualified applicants will receive consideration for employment without regard to race, color, religion, sex, gender identity, sexual orientation, national origin, or protected veteran status and will not be discriminated against on the basis of disability. NOTE: We do not accept resumes from external staffing agencies or independent recruiters for any of our openings unless we have a signed recruiting agreement in place to fill a specific position."
Data Scientist,Precision Solutions,United States,2023-06-23,Full-time,Entry level,"Hybrid | Crystal City, VA | 2-3 Days a week OnsiteSecret Clearance RequiredSummaryOur client provides leading edge cybersecurity services that improve security, promote innovation, and transform cybersecurity for government and commercial customers. Our client is on the front lines of the cyber landscape, specializing in unique cybersecurity solutions, infrastructure support, and end user support. They also remain committed to their clients’ success and ensure that their initiatives are properly aligned with their core mission.Our client works closely with their partners and clients to understand their needs and ensure their short and long term targets are met or exceeded. Their expert team works to design and execute progressive, innovative solutions that are helping our clients modernize their infrastructure and stay ahead of the constantly evolving thread landscape.They also believe in hiring smart people then giving them space to thrive. Staying ahead of the pack requires not just economic vigilance but ambitious business goals and a purposeful, cohesive workforce. Our client is able to attract and retain their professionals by consistently creating an environment based on trust, fairness and opportunity. Additionally, they believe in establishing open communication that encourages achievable performance expectations. With also incorporating collaboration within their organization, it creates a positive energy and true ownership in providing services that are essential to deliver results of the highest quality.ResponsibilitiesOur client is looking for a passionate and talented Data Scientist to join their team. The successful candidate will be a key contributor to driving the growth and innovation within our organization through the expert application of data science methodologies and techniques. This role requires a deep understanding of machine learning algorithms, data management, and analysis, as well as the ability to effectively communicate complex findings to a variety of stakeholders.Develop, validate, and implement data models and algorithms to meet business needsCollaborate with the data engineering team to design and maintain scalable data models and pipelinesConduct detailed analyses of our data and systems to generate insights and inform business decisionsDrive the collection of new data and the refinement of existing data sourcesCollaborate with cross-functional teams to define business requirements and deliver appropriate solutionsPresent complex data in a clear, concise manner to various stakeholders, including non-technical audiencesStay up-to-date on new research and technologies in the field of data science and machine learning, and educate the team on these developmentsRequirementsStrong knowledge of Python and familiarity with data processing tools like SQL, Hadoop, and SparkDeep understanding of machine learning algorithms, data structures, and performance optimization techniquesExcellent problem-solving skills and the ability to think critically and creativelyExceptional communication skills with the ability to articulate complex technical concepts to non-technical stakeholdersProven ability to work effectively in a dynamic, fast-paced environmentPreferred RequirementsA Bachelors or Master's degree or Ph.D. in Computer Science, Statistics, Mathematics, or a related field is preferred.Education RequirementsNone.Clearance RequirementsApplicants selected will be subject to a security investigation and may need to meet eligibility requirements for access to classified information; an active Secret clearance is required.Other DutiesPlease note this job description is not designed to cover or contain a comprehensive listing of activities, duties, or responsibilities that are required of the employee for this job. Duties, responsibilities, and activities may change at any time with or without notice.About UsNorthern Virginia-based Precision Solutions is an expert in staffing solutions for companies of any size that open the door to new opportunities and seek outstanding talent. We pride ourselves on being versatile enough to tailor our relationships to the needs of each individual client, being agile in the fast-paced marketplace, and being precise in meeting the needs of any company.Equal Opportunity Employer StatementPrecision Solutions is an equal opportunity employer. We prohibit discrimination and harassment of any kind based on race, color, sex, religion, sexual orientation, national origin, disability, genetic information, pregnancy, or any other protected characteristic as outlined by federal, state, or local laws."
Data Scientist - IL Lisle,Ryerson,United States,2023-06-20,Full-time,Entry level,"Position DescriptionRyerson has an opportunity for a Data Scientist position. As a Data Scientist you are responsible for optimizing data flow, maintaining state-of-the-art production, and providing solutions.The future will be made from metal. At Ryerson, you have the opportunity to grow in your career, work with teammates that feel like family, and help make our world a better place.This position will work a hybrid schedule.Roles And Responsibilities Design, architect, build, test, deploy and maintain state-of-the-art production grade ML/AI solutions Partner with data engineers and technology groups to optimize necessary data flow and needed data transformation to achieve high performance data science projects Be able to articulate analytics solutions in front of Business and Technical Stakeholders Use cloud native services from Azure cloud providers Apply advanced data analysis tools and techniques to provide insights and actionable recommendations Stay up to date on newest trends, techniques, tools and methodologies All other duties as assigned or duties, responsibilities, and activities may change at any time with or without noticePosition Requirements Degree in Engineering, Computer Science, Applied Mathematics, Statistics, or other quantitative field. Advanced degree (MS) preferred 3+ years’ experience in a Data Science, Machine Learning, AI environment Experience in building and deploying ML / AI algorithms in Python Demonstrated experience using Big Data tools (Databricks, Spark, Azure, SQL, R, Python) Excellent Working knowledge of data science space, data analysis, data preparation, data verification, and software development concepts Excellent organizational skills with emphasis on attention to detail, ability to organize tasks, manage multiple projects, create and maintain documentation, prioritize work and meet deadlines with minimal direct supervision Excellent communication and interpersonal skills; ability to interact across multiple departments and levels within a medium to large size enterpriseWe are an Equal Opportunity Employer and do not discriminate against any employee or applicant for employment because of race, color, sex (including gender identity, sexual orientation or preference, and pregnancy), age, national origin, religion, disability or genetic information, marital status, status as a veteran, or any other federal, state or local protected class or artificial barrier."
Data Scientist,eTeki Inc.,United States,2023-06-19,Part-time,Entry level,"At eTeki, top freelance Data Scientist professionals assess peers being considered for similar technical roles with the respect and courtesy of a face-to-face conversation. Your feedback helps recruiters and hiring managers focus their resources on the most qualified professionals in the hiring process.eTeki, a technical interviews-as-a-service platform, helps every organization, big or small, hire top-notch technical talent by matching technical interview experts with clients who need third-party screening expertise.The RoleWith your proficiency in Python, R, SQL, Spark Exploratory Data Analysis, Statistical Modeling, Hadoop, TensorFlow, and Java you can make a difference to our clients across the globe. You'll confirm interest on a per-job basis and availability on a per-candidate basis by using our platform and the support of a world-class team of product specialists. Your Responsibilities Will IncludeCreating predictive and prescriptive models that could have a positive impact on the business.Driving all data analytics activities ranging from conceptualisation, and visualisation to operationalisation.Performing statistical analysis on historical data to validate models.Working across stakeholders to identify and capitalise on opportunities to leverage data to drive business solutions.Prepare an agenda according to client specifications and best practices for predictive interview resultsReview the candidate’s resume in advance of the technical discussion to validate the accomplishments claimedFollow independent contractor’s guidelines pertaining to avoiding legal landmines and maintaining candidate morale during interactive video technical interviews.Assess the candidate’s technical competencies and depth of experience through structured questions and quantify using standardized rubricsWrite reports for clients that detail the technical strengths and weaknesses of the candidates.Ideal ProfileMinimum of 9 years of experience in data science, statistical analysis, and machine learning.Strong programming skills in languages such as Python, R, or Java, with expertise in data manipulation, modelling, and visualization libraries.Extensive experience in statistical analysis, predictive modelling, and machine learning techniques such as regression, classification, clustering, time series analysis, and neural networks.Proficiency in using machine learning frameworks and libraries such as TensorFlow, PyTorch, sci-kit-learn, or Spark MLlib.Solid understanding of database concepts and proficiency in SQL and working with large-scale relational databases.Experience with big data technologies such as Hadoop, Spark, or distributed computing frameworks is a plusWhat's on Offer?Data Scientist The right side gig for anyone who enjoys talking about technology and have the desire to raise hiring standards for your profession (while making extra money)"
Data Scientist,ABC Legal Services,United States,2023-06-15,Full-time,Mid-Senior level,"We are seeking a highly skilled and detail-oriented Gig Economy Compensation Specialist to join our team. In this role, you will be responsible for analyzing and optimizing compensation strategies for independent contractor drivers in the gig economy. Your focus will be on data analysis, market research, and conducting A/B testing to ensure fair and competitive compensation practices while maintaining a positive and transparent relationship with our drivers.Responsibilities:Conduct data analysis to evaluate driver earnings, incentives, and performance metrics to identify trends and opportunities for improvement. Collaborate with cross-functional teams to gather relevant data and insights, ensuring alignment with business goals and driver satisfaction. Conduct market research on compensation practices in the gig economy, staying up-to-date with industry trends and benchmarks. Design and implement A/B testing experiments to evaluate the impact of compensation changes on driver engagement, retention, and overall satisfaction. Analyze the results of A/B tests and provide recommendations for compensation adjustments based on data-driven insights. Develop and maintain compensation models and structures that are fair, transparent, and in line with industry standards. Partner with internal stakeholders to communicate compensation changes effectively and address driver concerns or questions. Monitor and evaluate the effectiveness of compensation programs, making ongoing refinements to ensure optimal driver satisfaction and retention. Stay informed about regulatory and legal requirements related to compensation practices in the gig economy, ensuring compliance in all activities. Requirements:Bachelor's degree in a relevant field such as business, economics, or data analytics. Proven experience in data analysis, preferably in a compensation or related field. Strong analytical skills with the ability to collect, organize, and interpret large datasets. Proficiency in statistical analysis and familiarity with A/B testing methodologies. Excellent communication skills with the ability to convey complex data findings to both technical and non-technical stakeholders. Knowledge of gig economy trends, compensation practices, and market dynamics. Ability to maintain confidentiality and handle sensitive information with professionalism and discretion. Strong attention to detail and a commitment to delivering accurate and reliable analysis. Ability to work independently, manage multiple projects simultaneously, and meet deadlines. Preferred Qualifications:Certified Compensation Professional (CCP)Gig economy industry experience highly desiredWe offer competitive compensation and benefits packages, along with a dynamic and inclusive work environment that values collaboration and innovation. As a Gig Economy Compensation Specialist, you will play a vital role in shaping our compensation strategies and ensuring the success and satisfaction of our independent contractor drivers while maintaining transparency and trust.Pay range: $80,000 to $120,000 per year"
